{"expected_facts_digest":"sha256:c5b3638ad25126fa25d41bd8e9fd06bebf36c57bb9f77ae95d86fefc2a429c9c","fixture_digest":"sha256:a64d2f890df008d6add6f2156100ff69d5759b2655bd6cc8bc37c4de61007853","mutation_authority_required":false,"replayable":true,"scenario_class":"warning-events","scenario_id":"warning-events-v1","schema_version":"vuoro.outctl.scenario-manifest/v1","seed":2026080906}
