{"expected_facts_digest":"sha256:afcd1a0766481d7a4a34e755e18badb8a499d20d23d5eed15e320716972b54b8","fixture_digest":"sha256:7a871fc9d685ef68004b1ff0fe1b29fe5fdb3cf2f762ce49187e6813f91679ff","mutation_authority_required":false,"replayable":true,"scenario_class":"node-not-ready","scenario_id":"node-not-ready-v1","schema_version":"vuoro.outctl.scenario-manifest/v1","seed":2026080902}
